{
  "id": "11111111-1111-4111-8111-111111111111",
  "workspaceId": "22222222-2222-4222-8222-222222222222",
  "status": "DRAFT",
  "version": 0,
  "createdAt": "2026-08-20T17:00:00Z",
  "updatedAt": "2026-08-20T17:00:00Z",
  "profile": {
    "application": {
      "type": "B2B_SAAS",
      "clients": ["BROWSER"]
    },
    "audience": {
      "populations": ["EXTERNAL_CUSTOMERS", "PARTNERS"],
      "tenancy": "MULTI_TENANT_ORGANIZATIONS",
      "membership": "MULTIPLE_ORGANIZATIONS_PER_USER"
    },
    "protocols": {
      "federation": {
        "OIDC": "REQUIRED",
        "SAML": "REQUIRED"
      },
      "oauth2ProtectedApis": "REQUIRED",
      "socialLogin": "PREFERRED",
      "enterpriseSingleSignOn": "REQUIRED"
    },
    "provisioning": {
      "scim": "REQUIRED",
      "justInTimeProvisioning": "PREFERRED",
      "groupSynchronization": "REQUIRED"
    },
    "security": {
      "multiFactorAuthentication": "REQUIRED",
      "browserTokenExposureMinimization": "PREFERRED",
      "auditability": "REQUIRED",
      "dataResidency": "UNKNOWN",
      "assurance": "BASELINE",
      "complianceTargets": []
    },
    "operations": {
      "hosting": "MANAGED",
      "deploymentTarget": "AZURE",
      "identityExpertise": "LIMITED",
      "budgetSensitivity": "HIGH"
    }
  }
}
